Network,School ID,School,Totals,year
AUSL,610339,Amos Alonzo Stagg Elementary School,589,2014
AUSL,610106,Brian Piccolo Elementary Specialty School,544,2014
AUSL,609883,Charles S Deneen Elementary School,619,2014
AUSL,610248,Chicago Academy Elementary School,600,2014
AUSL,610340,Chicago Academy High School,518,2014
AUSL,610499,Collins Academy High School,384,2014
AUSL,609885,Dewey Elementary Academy of Fine Arts,360,2014
AUSL,610543,Eric Solorio Academy High School,"1,068",2014
AUSL,609900,George W Curtis Elementary School,626,2014
AUSL,610103,Isabelle C O'Keeffe Elementary School,588,2014
AUSL,610274,James Weldon Johnson Elementary School,435,2014
AUSL,610263,John Foster Dulles Elementary School,788,2014
AUSL,609971,John Harvard Elementary School of Excellence,501,2014
AUSL,610000,Julia Ward Howe Elementary School of Excellence,646,2014
AUSL,610036,Leslie Lewis Elementary School,488,2014
AUSL,610053,Marquette Elementary School,"1,296",2014
AUSL,609888,Mary Mapes Dodge Elementary Renaissance Academy,248,2014
AUSL,609928,Melville W Fuller Elementary School,299,2014
AUSL,610257,Morton School of Excellence,412,2014
AUSL,609806,Myra Bradwell Communications Arts & Sciences ES,834,2014
AUSL,610231,National Teachers Elementary Academy,585,2014
AUSL,610389,Orr Academy High School,647,2014
AUSL,610021,Pablo Casals Elementary School,468,2014
AUSL,610396,Tarkington School of Excellence ES,"1,056",2014
AUSL,609991,Theodore Herzl Elementary School,554,2014
AUSL,609851,Thomas Chalmers Specialty Elementary School,406,2014
AUSL,609727,Wendell Phillips Academy High School,670,2014
AUSL,610172,William T Sherman Elementary School,391,2014
AUSL,609844,William W Carter Elementary School,439,2014
Military,610513,Air Force Academy High School,369,2014
Military,609754,Chicago Military Academy High School,405,2014
Military,609760,George Washington Carver Military Academy HS,529,2014
Military,610390,Hyman G Rickover Naval Academy High School,507,2014
Military,610502,Marine Military Math and Science Academy,401,2014
Military,610304,Phoenix Military Academy High School,497,2014
Network 1,610212,Albany Park Multicultural Academy,280,2014
Network 1,610209,Alessandro Volta Elementary School,"1,034",2014
Network 1,609836,Arthur E Canty Elementary School,812,2014
Network 1,609729,Carl Schurz High School,"2,379",2014
Network 1,609899,Christian Ebinger Elementary School,732,2014
Network 1,610083,Daniel C Beard Elementary School,169,2014
Network 1,610564,Disney II Magnet High School,247,2014
Network 1,610515,Disney II Magnet School,414,2014
Network 1,609901,Edgebrook Elementary School,504,2014
Network 1,610523,Edison Park Elementary School,470,2014
Network 1,609708,Edwin G Foreman High School,"1,507",2014
Network 1,610137,Ernst Prussing Elementary School,687,2014
Network 1,609874,Everett McKinley Dirksen Elementary School,807,2014
Network 1,610163,Frederick Stock Elementary School,241,2014
Network 1,609737,Friedrich W von Steuben Metropolitan Science HS,"1,666",2014
Network 1,609857,Grover Cleveland Elementary School,689,2014
Network 1,610182,Hannah G Solomon Elementary School,357,2014
Network 1,609972,Helge A Haugan Elementary School,"1,207",2014
Network 1,609798,Hiram H Belding Elementary School,606,2014
Network 1,609766,Jacqueline B Vaughn Occupational High School,214,2014
Network 1,609912,James B Farnsworth Elementary School,597,2014
Network 1,609796,Jean Baptiste Beaubien Elementary School,"1,166",2014
Network 1,610089,John B Murphy Elementary School,606,2014
Network 1,610111,John Palmer Elementary School,906,2014
Network 1,609937,John W Garvy Elementary School,792,2014
Network 1,610159,Jonathan Y Scammon Elementary School,872,2014
Network 1,610127,Mary Gage Peterson Elementary School,860,2014
Network 1,609792,Newton Bateman Elementary School,"1,036",2014
Network 1,609810,Norman A Bridge Elementary School,"1,049",2014
Network 1,610354,North River Elementary School,403,2014
Network 1,609749,Northside College Preparatory High School,"1,069",2014
Network 1,609744,Northside Learning Center High School,284,2014
Network 1,610099,Norwood Park Elementary School,367,2014
Network 1,610201,Ole A Thorp Elementary Scholastic Academy,846,2014
Network 1,610105,Oriole Park Elementary School,661,2014
Network 1,609988,Patrick Henry Elementary School,683,2014
Network 1,610145,Peter A Reinberg Elementary School,840,2014
Network 1,610135,Portage Park Elementary School,"1,114",2014
Network 1,609995,Rufus M Hitch Elementary School,586,2014
Network 1,610155,Sauganash Elementary School,553,2014
Network 1,609728,Theodore Roosevelt High School,"1,437",2014
Network 1,609794,Thomas A Edison Regional Gifted Center ES,276,2014
Network 1,610321,Thurgood Marshall Middle School,275,2014
Network 1,610179,Washington D Smyser Elementary School,"1,006",2014
Network 1,610230,Wildwood Elementary School,424,2014
Network 1,609884,William E Dever Elementary School,847,2014
Network 1,609994,William G Hibbard Elementary School,"1,221",2014
Network 1,609734,William Howard Taft High School,"3,195",2014
Network 1,610104,William J Onahan Elementary School,670,2014
Network 1,609949,William P Gray Elementary School,"1,303",2014
Network 2,609804,Daniel Boone Elementary School,805,2014
Network 2,609859,DeWitt Clinton Elementary School,"1,147",2014
Network 2,609852,Eliza Chappell Elementary School,551,2014
Network 2,609918,Eugene Field Elementary School,390,2014
Network 2,609779,George Armstrong International Studies ES,"1,444",2014
Network 2,610196,George B Swift Elementary Specialty School,696,2014
Network 2,610122,Helen Peirce International Studies ES,"1,041",2014
Network 2,610070,James B McPherson Elementary School,827,2014
Network 2,609866,John C Coonley Elementary School,732,2014
Network 2,610269,John T McCutcheon Elementary School,502,2014
Network 2,609865,Jordan Elementary Community School,656,2014
Network 2,610242,Joseph Brennemann Elementary School,502,2014
Network 2,610022,Joyce Kilmer Elementary School,804,2014
Network 2,609719,Lake View High School,"1,436",2014
Network 2,609817,Lyman A Budlong Elementary School,874,2014
Network 2,610355,Mary E Courtenay Elementary Language Arts Center,631,2014
Network 2,610011,Minnie Mars Jamieson Elementary School,900,2014
Network 2,610284,New Field Elementary School,589,2014
Network 2,609730,Nicholas Senn High School,"1,162",2014
Network 2,610147,Philip Rogers Elementary School,752,2014
Network 2,610141,Ravenswood Elementary School,508,2014
Network 2,609695,Roald Amundsen High School,"1,266",2014
Network 2,609733,Roger C Sullivan High School,708,2014
Network 2,609880,Stephen Decatur Classical Elementary School,286,2014
Network 2,609933,Stephen F Gale Elementary Community Academy,462,2014
Network 2,609976,Stephen K Hayt Elementary School,984,2014
Network 2,609724,Stephen T Mather High School,"1,623",2014
Network 2,610191,Stone Elementary Scholastic Academy,634,2014
Network 2,610220,Thomas J Waters Elementary School,670,2014
Network 2,610394,Uplift Community High School,354,2014
Network 2,610363,Walt Disney Magnet Elementary School,"1,678",2014
Network 2,610542,West Ridge Elementary School,753,2014
Network 2,609945,William C Goudy Elementary School,797,2014
Network 3,400018,Austin Business and Entrepreneurship Academy HS,186,2014
Network 3,610501,Austin Polytechnical Academy High School,196,2014
Network 3,609922,Belmont-Cragin Elementary School,587,2014
Network 3,609679,Charles Allen Prosser Career Academy High School,"1,514",2014
Network 3,609732,Charles P Steinmetz College Preparatory HS,"1,809",2014
Network 3,610533,Dr Jorge Prieto Math and Science,"1,051",2014
Network 3,609904,Edward K Ellington Elementary School,735,2014
Network 3,610235,Ella Flagg Young Elementary School,"1,085",2014
Network 3,610165,Franz Peter Schubert Elementary School,967,2014
Network 3,610245,Frederick A Douglass Academy High School,291,2014
Network 3,610305,George Leland Elementary School,673,2014
Network 3,609795,George Rogers Clark Elementary School,279,2014
Network 3,610068,Hanson Park Elementary School,"1,612",2014
Network 3,610158,Harriet E Sayre Elementary Language Academy,571,2014
Network 3,610040,Henry D Lloyd Elementary School,"1,268",2014
Network 3,610092,Henry H Nash Elementary School,403,2014
Network 3,609975,John Hay Elementary Community Academy,541,2014
Network 3,610043,Joseph Lovett Elementary School,469,2014
Network 3,610041,Josephine C Locke Elementary School,"1,389",2014
Network 3,609910,Laughlin Falconer Elementary School,"1,434",2014
Network 3,609818,Luther Burbank Elementary School,955,2014
Network 3,610539,Marvin Camras Elementary School,"1,001",2014
Network 3,610046,Mary Lyon Elementary School,"1,425",2014
Network 3,610244,Michele Clark Academic Prep Magnet High School,499,2014
Network 3,609830,Milton Brunson Math & Science Specialty ES,645,2014
Network 3,610051,Northwest Middle School,667,2014
Network 3,610367,Oscar DePriest Elementary School,723,2014
Network 3,610282,Ronald E McNair Elementary School,382,2014
Network 3,610183,Spencer Technology Academy,864,2014
Network 3,610518,VOISE Academy High School,341,2014
Network 4,610038,Abraham Lincoln Elementary School,808,2014
Network 4,609720,Albert G Lane Technical High School,"4,120",2014
Network 4,610524,Alcott High School for the Humanities,281,2014
Network 4,609799,Alexander Graham Bell Elementary School,"1,048",2014
Network 4,609963,Alexander Hamilton Elementary School,381,2014
Network 4,609780,Ames Middle School,542,2014
Network 4,609820,Augustus H Burley Elementary School,550,2014
Network 4,610039,Carl von Linne Elementary School,677,2014
Network 4,609875,Charles R Darwin Elementary School,593,2014
Network 4,610402,DeVry University Advantage Academy HS,192,2014
Network 4,610541,Federico Garcia Lorca Elementary School,905,2014
Network 4,610144,Frank W Reilly Elementary School,"1,150",2014
Network 4,609926,Franklin Elementary Fine Arts Center,371,2014
Network 4,609930,Frederick Funston Elementary School,591,2014
Network 4,610010,Friedrich Ludwig Jahn Elementary School,469,2014
Network 4,609974,Hawthorne Elementary Scholastic Academy,574,2014
Network 4,609850,Horace Greeley Elementary School,637,2014
Network 4,610078,Inter-American Elementary Magnet School,667,2014
Network 4,609803,James G Blaine Elementary School,943,2014
Network 4,610074,James Monroe Elementary School,"1,053",2014
Network 4,609942,Johann W von Goethe Elementary School,807,2014
Network 4,609789,John Barry Elementary School,831,2014
Network 4,609782,John J Audubon Elementary School,591,2014
Network 4,610033,LaSalle Elementary Language Academy,555,2014
Network 4,609738,Lincoln Park High School,"2,230",2014
Network 4,610325,Logandale Middle School,894,2014
Network 4,609773,Louis A Agassiz Elementary School,484,2014
Network 4,610094,Louis Nettelhorst Elementary School,797,2014
Network 4,609774,Louisa May Alcott Elementary School,510,2014
Network 4,610059,Oscar F Mayer Elementary School,614,2014
Network 4,609853,Salmon P Chase Elementary School,498,2014
Network 4,609968,Sharon Christa McAuliffe Elementary School,677,2014
Network 4,610534,Skinner North,368,2014
Network 4,610095,Walter L Newberry Math & Science Academy ES,563,2014
Network 4,610136,William H Prescott Elementary School,288,2014
Network 4,610097,William P Nixon Elementary School,"1,059",2014
Network 4,610088,Wolfgang A Mozart Elementary School,836,2014
Network 5,610342,Albert R Sabin Elementary Magnet School,626,2014
Network 5,610098,Alfred Nobel Elementary School,842,2014
Network 5,610131,Ambrose Plamondon Elementary School,163,2014
Network 5,610076,Bernhard Moos Elementary School,500,2014
Network 5,610005,Charles Evans Hughes Elementary School,329,2014
Network 5,610194,Charles Sumner  Math & Science Community Acad ES,417,2014
Network 5,609863,Christopher Columbus Elementary School,294,2014
Network 5,609835,Daniel R Cameron Elementary School,811,2014
Network 5,610221,Daniel Webster Elementary School,337,2014
Network 5,610254,Dvorak Technology Academy,547,2014
Network 5,610073,Ellen Mitchell Elementary School,362,2014
Network 5,610503,Frazier Prospective IB Magnet ES,265,2014
Network 5,609854,Frederic Chopin Elementary School,594,2014
Network 5,610293,Genevieve Melody Elementary School,618,2014
Network 5,610202,George W Tilton Elementary School,448,2014
Network 5,609693,George Westinghouse College Prep,"1,125",2014
Network 5,610192,Harriet Beecher Stowe Elementary School,794,2014
Network 5,609985,Helen M Hefferan Elementary School,427,2014
Network 5,610044,James Russell Lowell Elementary School,644,2014
Network 5,610271,Jensen Elementary Scholastic Academy,503,2014
Network 5,609723,John Marshall Metropolitan High School,624,2014
Network 5,609954,John Milton Gregory Elementary School,435,2014
Network 5,610313,Jose De Diego Elementary Community Academy,934,2014
Network 5,609925,Joseph Kellman Corporate Community ES,439,2014
Network 5,610133,Laura S Ward Elementary School,674,2014
Network 5,609722,Manley Career Academy High School,450,2014
Network 5,610055,Michael Faraday Elementary School,347,2014
Network 5,609691,North-Grand High School,910,2014
Network 5,610234,Richard Yates Elementary School,675,2014
Network 5,610056,Roswell B Mason Elementary School,485,2014
Network 5,610100,West Park Elementary Academy,646,2014
Network 5,610251,Willa Cather Elementary School,451,2014
Network 5,610123,William Penn Elementary School,404,2014
Network 6,610229,A.N. Pritzker School,699,2014
Network 6,609947,Alexander Graham Elementary School,476,2014
Network 6,610060,Andrew Jackson Elementary Language Academy,567,2014
Network 6,609996,Charles N Holden Elementary School,528,2014
Network 6,610012,Edward Jenner Elementary Academy of the Arts,278,2014
Network 6,610009,Galileo Math & Science Scholastic Academy ES,559,2014
Network 6,610062,George B McClellan Elementary School,293,2014
Network 6,610107,James Otis Elementary School,635,2014
Network 6,610217,James Ward Elementary School,519,2014
Network 6,609959,John Charles Haines Elementary School,672,2014
Network 6,609828,Jonathan Burr Elementary School,388,2014
Network 6,610520,LaSalle II Magnet Elementary School,623,2014
Network 6,610197,Mancel Talcott Elementary School,535,2014
Network 6,610081,Mark Sheridan Elementary Math & Science Academy,545,2014
Network 6,610177,Mark Skinner Elementary School,903,2014
Network 6,610075,Moses Montefiore Special Elementary School,58,2014
Network 6,610529,Ogden International High School,784,2014
Network 6,609777,Phillip D Armour Elementary School,324,2014
Network 6,610138,Pulaski International School of Chicago,895,2014
Network 6,609769,Ray Graham Training Center High School,123,2014
Network 6,610561,Richard T Crane Medical Preparatory HS,149,2014
Network 6,609702,Richard T Crane Technical Preparatory HS,162,2014
Network 6,609979,Robert Healy Elementary School,"1,418",2014
Network 6,610252,Robert Nathaniel Dett Elementary School,470,2014
Network 6,610029,Rodolfo Lozano Bilingual & International Ctr ES,290,2014
Network 6,610250,Rueben Salazar Elementary Bilingual Center,405,2014
Network 6,610548,STEM Magnet Academy,334,2014
Network 6,609990,South Loop Elementary School,867,2014
Network 6,610405,Suder Montessori Magnet ES,417,2014
Network 6,609896,Thomas Drummond Elementary School,349,2014
Network 6,609680,Walter Payton College Preparatory High School,819,2014
Network 6,610121,Washington Irving Elementary School,488,2014
Network 6,609755,Whitney M Young Magnet High School,"2,196",2014
Network 6,610101,William B Ogden Elementary School,822,2014
Network 6,609678,William Jones College Preparatory High School,"1,124",2014
Network 6,610308,Wilma Rudolph Elementary Learning Center,109,2014
Network 7,610063,Cyrus H McCormick Elementary School,875,2014
Network 7,609870,Daniel J Corkery Elementary School,607,2014
Network 7,609704,David G Farragut Career Academy High School,"1,100",2014
Network 7,610227,Eli Whitney Elementary School,"1,097",2014
Network 7,609973,Emiliano Zapata Elementary Academy,967,2014
Network 7,610215,Francisco I Madero Middle School,316,2014
Network 7,609920,Gerald Delgado Kanoon Elementary Magnet School,747,2014
Network 7,610383,Greater Lawndale High School For Social Justice,356,2014
Network 7,610384,Infinity Math Science and Technology High School,411,2014
Network 7,610125,Irma C Ruiz Elementary School,897,2014
Network 7,610216,John A Walsh Elementary School,450,2014
Network 7,610228,John Greenleaf Whittier Elementary School,348,2014
Network 7,610184,John Spry Elementary Community School,734,2014
Network 7,609950,Josefa Ortiz De Dominguez Elementary School,728,2014
Network 7,609938,Joseph E Gary Elementary School,"1,206",2014
Network 7,610015,Joseph Jungman Elementary School,272,2014
Network 7,610129,Josiah Pickard Elementary School,614,2014
Network 7,610024,Lazaro Cardenas Elementary School,713,2014
Network 7,609834,Little Village Elementary School,868,2014
Network 7,609872,Manuel Perez Elementary School,349,2014
Network 7,610017,Maria Saucedo Elementary Scholastic Academy,"1,281",2014
Network 7,610385,Multicultural Academy of Scholarship,280,2014
Network 7,610329,Orozco Fine Arts & Sciences Elementary School,616,2014
Network 7,609867,Peter Cooper Elementary Dual Language Academy,635,2014
Network 7,610013,Pilsen Elementary Community Academy,439,2014
Network 7,609826,Rosario Castellanos Elementary School,586,2014
Network 7,610357,Spry Community Links High School,189,2014
Network 7,609967,William F Finkl Elementary School,524,2014
Network 7,610392,World Language Academy High School,353,2014
Network 8,609993,Agustin Lara Elementary Academy,540,2014
Network 8,610563,Back of the Yards IB HS,281,2014
Network 8,610317,Brighton Park Elementary School,593,2014
Network 8,610353,Calmeca Academy of Fine Arts and Dual Language,811,2014
Network 8,610148,Cesar E Chavez Multicultural Academic Center ES,947,2014
Network 8,610170,Columbia Explorers Elementary Academy,"1,083",2014
Network 8,609909,Edward Everett Elementary School,256,2014
Network 8,610203,Enrico Tonti Elementary School,"1,084",2014
Network 8,610319,Evergreen Academy Middle School,388,2014
Network 8,610120,Ferdinand Peck Elementary School,"1,608",2014
Network 8,610096,Florence Nightingale Elementary School,"1,389",2014
Network 8,609958,Frank W Gunsaulus Elementary Scholastic Academy,862,2014
Network 8,609709,Gage Park High School,613,2014
Network 8,610532,Irene C. Hernandez Middle School for the Advancem,916,2014
Network 8,609983,James Hedges Elementary School,850,2014
Network 8,610174,James Shields Elementary School,"1,051",2014
Network 8,610559,James Shields Middle School,717,2014
Network 8,609829,John C Burroughs Elementary School,519,2014
Network 8,609964,John H Hamline Elementary School,681,2014
Network 8,610117,Louis Pasteur Elementary School,"1,222",2014
Network 8,609756,Marie Sklodowska Curie Metropolitan High School,"2,982",2014
Network 8,609876,Nathan S Davis Elementary School,916,2014
Network 8,609952,Nathanael Greene Elementary School,642,2014
Network 8,609842,Rachel Carson Elementary School,"1,222",2014
Network 8,609903,Richard Edwards Elementary School,"1,520",2014
Network 8,610239,Richard J Daley Elementary Academy,709,2014
Network 8,610157,Sidney Sawyer Elementary School,"1,837",2014
Network 8,610226,Socorro Sandoval Elementary School,"1,133",2014
Network 8,610249,Talman Elementary School,419,2014
Network 8,610504,Velma F Thomas Early Childhood Center,176,2014
Network 8,609855,Walter S Christopher Elementary School,360,2014
Network 8,610167,William H Seward Communication Arts Academy ES,849,2014
Network 9,609951,Ariel Elementary Community Academy,565,2014
Network 9,610175,Beulah Shoesmith Elementary School,343,2014
Network 9,609969,Bret Harte Elementary School,363,2014
Network 9,610345,Carter G Woodson South Elementary School,378,2014
Network 9,610030,Charles Kozminski Elementary Community Academy,394,2014
Network 9,609781,Crispus Attucks Elementary School,168,2014
Network 9,610380,Daniel Hale Williams Prep School of Medicine,300,2014
Network 9,609751,Dr  Martin Luther King  Jr  College Prep HS,804,2014
Network 9,609736,Dyett High School,83,2014
Network 9,610246,Edward Beasley Elementary Magnet Academic Center,"1,403",2014
Network 9,610065,Emmett Louis Till Math and Science Academy,421,2014
Network 9,609713,Hyde Park Academy High School,"1,001",2014
Network 9,610110,Ida B Wells Preparatory Elementary Academy,490,2014
Network 9,610276,Irvin C Mollison Elementary School,505,2014
Network 9,609891,James R Doolittle Jr Elementary School,304,2014
Network 9,610213,James Wadsworth Elementary School,522,2014
Network 9,609894,John B Drake Elementary School,517,2014
Network 9,609919,John Fiske Elementary School,507,2014
Network 9,610126,John J Pershing Elementary Humanities Magnet,447,2014
Network 9,609746,Kenwood Academy High School,"1,814",2014
Network 9,610237,Ludwig Van Beethoven Elementary School,395,2014
Network 9,610018,Miriam G Canter Middle School,95,2014
Network 9,609676,Paul Laurence Dunbar Career Academy High School,"1,188",2014
Network 9,610090,Phillip Murray Elementary Language Academy,535,2014
Network 9,609987,Thomas A Hendricks Elementary Community Academy,271,2014
Network 9,610142,William H Ray Elementary School,721,2014
Network 9,609977,Woodlawn Community Elementary School,230,2014
Network 10,610185,Adlai E Stevenson Elementary School,"1,264",2014
Network 10,610084,Annie Keller Elementary Gifted Magnet School,248,2014
Network 10,610287,Ashburn Community Elementary School,475,2014
Network 10,609871,Barbara Vick Early Childhood & Family Center,348,2014
Network 10,610087,Blair Early Childhood Center,192,2014
Network 10,609839,Carroll-Rosenwald Specialty Elementary School,533,2014
Network 10,609879,Charles Gates Dawes Elementary School,"1,028",2014
Network 10,609753,Chicago High School for Agricultural Sciences,651,2014
Network 10,610347,Claremont Academy Elementary School,477,2014
Network 10,610077,Donald Morrill Math & Science Elementary School,816,2014
Network 10,610352,Durkin Park Elementary School,592,2014
Network 10,610006,Edward N Hurley Elementary School,854,2014
Network 10,610195,Elizabeth H Sutherland Elementary School,737,2014
Network 10,610057,Fairfield Elementary Academy,575,2014
Network 10,610067,Francis M McKay Elementary School,884,2014
Network 10,609849,George F Cassell Elementary School,367,2014
Network 10,609741,Gurdon S Hubbard High School,"1,615",2014
Network 10,609861,Henry R Clissold Elementary School,560,2014
Network 10,609893,John C Dore Elementary School,646,2014
Network 10,609898,John F Eberhart Elementary School,"1,591",2014
Network 10,609718,John F Kennedy High School,"1,506",2014
Network 10,610026,John H Kinzie Elementary School,684,2014
Network 10,610207,John H Vanderpoel Elementary Magnet School,298,2014
Network 10,610016,Kate S Kellogg Elementary School,265,2014
Network 10,609807,Lionel Hampton Fine & Performing Arts ES,614,2014
Network 10,610544,Mariano Azuela Elementary School,944,2014
Network 10,610206,Mark Twain Elementary School,"1,201",2014
Network 10,609832,Michael M Byrne Elementary School,671,2014
Network 10,610082,Mount Greenwood Elementary School,999,2014
Network 10,609960,Nathan Hale Elementary School,872,2014
Network 10,609981,Phobe Apperson Hearst Elementary School,353,2014
Network 10,610291,Richard Henry Lee Elementary School,878,2014
Network 10,609956,Robert L Grimes Elementary School,477,2014
Network 10,610558,Sarah E. Goode STEM Academy,462,2014
Network 10,610109,William Bishop Owen Scholastic Academy ES,252,2014
Network 11,609869,Anna R. Langford Community Academy,444,2014
Network 11,610037,Arthur A Libby Elementary School,510,2014
Network 11,609941,Asa Philip Randolph Elementary School,500,2014
Network 11,610290,Benjamin E Mays Elementary Academy,606,2014
Network 11,610238,Carrie Jacobs Bond Elementary School,420,2014
Network 11,610366,Charles H Wacker Elementary School,245,2014
Network 11,609986,Charles R Henderson Elementary School,370,2014
Network 11,609897,Charles W Earle Elementary School,530,2014
Network 11,609790,Clara Barton Elementary School,591,2014
Network 11,610223,Daniel S Wentworth Elementary School,611,2014
Network 11,609924,Fort Dearborn Elementary School,416,2014
Network 11,609927,Foster Park Elementary School,395,2014
Network 11,610112,Francis W Parker Elementary Community Academy,791,2014
Network 11,609768,Hope College Preparatory High School,391,2014
Network 11,610173,Jesse Sherwood Elementary School,407,2014
Network 11,609864,John W Cook Elementary School,437,2014
Network 11,610019,Joshua D Kershaw Elementary School,277,2014
Network 11,610298,Lenart Elementary Regional Gifted Center,303,2014
Network 11,610108,Luke O'Toole Elementary School,419,2014
Network 11,610369,Mahalia Jackson Elementary School,339,2014
Network 11,610362,Medgar Evers Elementary School,395,2014
Network 11,609692,Neal F Simeon Career Academy High School,"1,467",2014
Network 11,609793,Nicholson Technology Academy,570,2014
Network 11,610300,Oliver S Westcott Elementary School,420,2014
Network 11,610003,Paul Cuffe Math-Science Technology Academy ES,459,2014
Network 11,609707,Paul Robeson High School,372,2014
Network 11,609791,Perkins Bass Elementary School,566,2014
Network 11,610102,Richard J Oglesby Elementary School,480,2014
Network 11,609929,Robert Fulton Elementary School,498,2014
Network 11,610391,Robert Lindblom Math & Science Academy HS,"1,156",2014
Network 11,610027,Rudyard Kipling Elementary School,402,2014
Network 11,610521,Sir Miles Davis Magnet Elementary Academy,336,2014
Network 11,609745,Southside Occupational Academy High School,228,2014
Network 11,610506,TEAM Englewood Community Academy High School,407,2014
