Network,School ID,School,Total,Year,Area
ES Network - Pilsen-Little Village,610227,Eli Whitney Elementary School,"1,080",2013,
ES Network - Pilsen-Little Village,609973,Emiliano Zapata Elementary Academy,985,2013,
ES Network - Pilsen-Little Village,610215,Francisco I Madero Middle School,317,2013,
ES Network - Pilsen-Little Village,609920,Gerald Delgado Kanoon Elementary Magnet School,747,2013,
ES Network - Pilsen-Little Village,610273,Ignance Paderewski Elementary Learning Academy,172,2013,
ES Network - Pilsen-Little Village,610125,Irma C Ruiz Elementary School,931,2013,
ES Network - Pilsen-Little Village,610216,John A Walsh Elementary School,455,2013,
ES Network - Pilsen-Little Village,610228,John Greenleaf Whittier Elementary School,385,2013,
ES Network - Pilsen-Little Village,610184,John Spry Elementary Community School,757,2013,
ES Network - Pilsen-Little Village,609950,Josefa Ortiz De Dominguez Elementary School,768,2013,
ES Network - Pilsen-Little Village,609938,Joseph E Gary Elementary School,"1,194",2013,
ES Network - Pilsen-Little Village,610015,Joseph Jungman Elementary School,273,2013,
ES Network - Pilsen-Little Village,610129,Josiah Pickard Elementary School,641,2013,
ES Network - Pilsen-Little Village,610024,Lazaro Cardenas Elementary School,657,2013,
ES Network - Pilsen-Little Village,609834,Little Village Elementary School,872,2013,
ES Network - Pilsen-Little Village,609872,Manuel Perez Elementary School,379,2013,
ES Network - Pilsen-Little Village,610017,Maria Saucedo Elementary Scholastic Academy,"1,258",2013,
ES Network - Pilsen-Little Village,610329,Orozco Fine Arts & Sciences Elementary School,621,2013,
ES Network - Pilsen-Little Village,609867,Peter Cooper Elementary Dual Language Academy,703,2013,
ES Network - Pilsen-Little Village,610013,Pilsen Elementary Community Academy,486,2013,
ES Network - Pilsen-Little Village,609826,Rosario Castellanos Elementary School,545,2013,
ES Network - Pilsen-Little Village,609921,Telpochcalli Elementary School,266,2013,
ES Network - Pilsen-Little Village,609967,William F Finkl Elementary School,540,2013,
ES Network - Ravenswood-Ridge,609799,Alexander Graham Bell Elementary School,986,2013,
ES Network - Ravenswood-Ridge,609963,Alexander Hamilton Elementary School,371,2013,
ES Network - Ravenswood-Ridge,609820,Augustus H Burley Elementary School,572,2013,
ES Network - Ravenswood-Ridge,609804,Daniel Boone Elementary School,767,2013,
ES Network - Ravenswood-Ridge,609859,DeWitt Clinton Elementary School,"1,125",2013,
ES Network - Ravenswood-Ridge,609852,Eliza Chappell Elementary School,493,2013,
ES Network - Ravenswood-Ridge,609918,Eugene Field Elementary School,384,2013,
ES Network - Ravenswood-Ridge,610010,Friedrich Ludwig Jahn Elementary School,471,2013,
ES Network - Ravenswood-Ridge,609779,George Armstrong International Studies ES,"1,412",2013,
ES Network - Ravenswood-Ridge,610196,George B Swift Elementary Specialty School,735,2013,
ES Network - Ravenswood-Ridge,610187,Graeme Stewart Elementary School,256,2013,
ES Network - Ravenswood-Ridge,609974,Hawthorne Elementary Scholastic Academy,574,2013,
ES Network - Ravenswood-Ridge,610122,Helen Peirce International Studies ES,"1,009",2013,
ES Network - Ravenswood-Ridge,609850,Horace Greeley Elementary School,617,2013,
ES Network - Ravenswood-Ridge,610078,Inter-American Elementary Magnet School,683,2013,
ES Network - Ravenswood-Ridge,610070,James B McPherson Elementary School,704,2013,
ES Network - Ravenswood-Ridge,609803,James G Blaine Elementary School,960,2013,
ES Network - Ravenswood-Ridge,609866,John C Coonley Elementary School,716,2013,
ES Network - Ravenswood-Ridge,609782,John J Audubon Elementary School,592,2013,
ES Network - Ravenswood-Ridge,610269,John T McCutcheon Elementary School,373,2013,
ES Network - Ravenswood-Ridge,609865,Jordan Elementary Community School,667,2013,
ES Network - Ravenswood-Ridge,610242,Joseph Brennemann Elementary School,320,2013,
ES Network - Ravenswood-Ridge,610189,Joseph Stockton Elementary School,475,2013,
ES Network - Ravenswood-Ridge,610022,Joyce Kilmer Elementary School,803,2013,
ES Network - Ravenswood-Ridge,609773,Louis A Agassiz Elementary School,455,2013,
ES Network - Ravenswood-Ridge,610094,Louis Nettelhorst Elementary School,739,2013,
ES Network - Ravenswood-Ridge,609817,Lyman A Budlong Elementary School,841,2013,
ES Network - Ravenswood-Ridge,610205,Lyman Trumbull Elementary School,389,2013,
ES Network - Ravenswood-Ridge,610355,Mary E Courtenay Elementary Language Arts Center,281,2013,
ES Network - Ravenswood-Ridge,610011,Minnie Mars Jamieson Elementary School,832,2013,
ES Network - Ravenswood-Ridge,610284,New Field Elementary School,597,2013,
ES Network - Ravenswood-Ridge,610147,Philip Rogers Elementary School,737,2013,
ES Network - Ravenswood-Ridge,610141,Ravenswood Elementary School,475,2013,
ES Network - Ravenswood-Ridge,609880,Stephen Decatur Classical Elementary School,280,2013,
ES Network - Ravenswood-Ridge,609933,Stephen F Gale Elementary Community Academy,513,2013,
ES Network - Ravenswood-Ridge,609976,Stephen K Hayt Elementary School,967,2013,
ES Network - Ravenswood-Ridge,610191,Stone Elementary Scholastic Academy,636,2013,
ES Network - Ravenswood-Ridge,610220,Thomas J Waters Elementary School,612,2013,
ES Network - Ravenswood-Ridge,610363,Walt Disney Magnet Elementary School,"1,620",2013,
ES Network - Ravenswood-Ridge,610542,West Ridge Elementary School,709,2013,
ES Network - Ravenswood-Ridge,609945,William C Goudy Elementary School,787,2013,
ES Network - Rock Island,609808,Alex Haley Elementary Academy,529,2013,
ES Network - Rock Island,610028,Alfred David Kohn Elementary School,390,2013,
ES Network - Rock Island,609788,Alice L Barnard Computer Math & Science Ctr ES,262,2013,
ES Network - Rock Island,610084,Annie Keller Elementary Gifted Magnet School,247,2013,
ES Network - Rock Island,609871,Barbara Vick Early Childhood & Family Center,322,2013,
ES Network - Rock Island,610366,Charles H Wacker Elementary School,243,2013,
ES Network - Rock Island,610004,Countee Cullen Elementary School,245,2013,
ES Network - Rock Island,610188,Dunne Technology Academy,299,2013,
ES Network - Rock Island,610195,Elizabeth H Sutherland Elementary School,735,2013,
ES Network - Rock Island,609908,Esmond Elementary School,339,2013,
ES Network - Rock Island,609917,Fernwood Elementary School,322,2013,
ES Network - Rock Island,609924,Fort Dearborn Elementary School,429,2013,
ES Network - Rock Island,609800,Frank I Bennett Elementary School,468,2013,
ES Network - Rock Island,609939,Frank L Gillespie Elementary School,638,2013,
ES Network - Rock Island,609849,George F Cassell Elementary School,351,2013,
ES Network - Rock Island,609861,Henry R Clissold Elementary School,553,2013,
ES Network - Rock Island,610176,John D Shoop Math-Science Technical Academy ES,529,2013,
ES Network - Rock Island,610207,John H Vanderpoel Elementary Magnet School,306,2013,
ES Network - Rock Island,610016,Kate S Kellogg Elementary School,266,2013,
ES Network - Rock Island,610368,Langston Hughes Elementary School,417,2013,
ES Network - Rock Island,610128,Marcus Moziah Garvey Elementary School,315,2013,
ES Network - Rock Island,610362,Medgar Evers Elementary School,379,2013,
ES Network - Rock Island,610208,Mildred I Lavizzo Elementary School,403,2013,
ES Network - Rock Island,610082,Mount Greenwood Elementary School,963,2013,
ES Network - Rock Island,610086,Mount Vernon Elementary School,305,2013,
ES Network - Rock Island,610027,Rudyard Kipling Elementary School,429,2013,
ES Network - Rock Island,609895,Turner-Drew Elementary Language Academy,363,2013,
ES Network - Rock Island,610032,Wendell E Green Elementary School,256,2013,
ES Network - Skyway,610281,Adam Clayton Powell Paideia Community Academy ES,532,2013,
ES Network - Skyway,610316,Amelia Earhart Options for Knowledge ES,247,2013,
ES Network - Skyway,610171,Arnold Mireles Elementary Academy,834,2013,
ES Network - Skyway,609887,Arthur Dixon Elementary School,631,2013,
ES Network - Skyway,610268,Arthur R Ashe Elementary School,394,2013,
ES Network - Skyway,609786,Avalon Park Elementary School,310,2013,
ES Network - Skyway,609827,Burnside Elementary Scholastic Academy,771,2013,
ES Network - Skyway,609833,Charles P Caldwell Academy of Math & Science ES,339,2013,
ES Network - Skyway,609813,Charles S Brownell Elementary School,299,2013,
ES Network - Skyway,609815,Edward A Bouchet Math & Science Academy ES,712,2013,
ES Network - Skyway,609862,Edward Coles Elementary Language Academy,565,2013,
ES Network - Skyway,610233,Elihu Yale Elementary School,186,2013,
ES Network - Skyway,609916,Enrico Fermi Elementary School,237,2013,
ES Network - Skyway,610124,Harold Washington Elementary School,527,2013,
ES Network - Skyway,610279,Henry O Tanner Elementary School,443,2013,
ES Network - Skyway,610052,Horace Mann Elementary School,457,2013,
ES Network - Skyway,610103,Isabelle C O'Keeffe Elementary School,576,2013,
ES Network - Skyway,610066,James E McDade Elementary Classical School,196,2013,
ES Network - Skyway,610047,James Madison Elementary School,280,2013,
ES Network - Skyway,610200,James N Thorp Elementary School,417,2013,
ES Network - Skyway,610093,Jane A Neil Elementary School,313,2013,
ES Network - Skyway,610130,John T Pirie Fine Arts & Academic Center ES,375,2013,
ES Network - Skyway,610218,Joseph Warren Elementary School,314,2013,
ES Network - Skyway,610280,Kate S Buckingham Special Education Center,35,2013,
ES Network - Skyway,610298,Lenart Elementary Regional Gifted Center,319,2013,
ES Network - Skyway,610152,Martha Ruggles Elementary School,414,2013,
ES Network - Skyway,610312,Mary E McDowell Elementary School,191,2013,
ES Network - Skyway,609961,Ninos Heroes Elementary Academic Center,475,2013,
ES Network - Skyway,610300,Oliver S Westcott Elementary School,413,2013,
ES Network - Skyway,610115,Park Manor Elementary School,338,2013,
ES Network - Skyway,610116,Parkside Elementary Community Academy,318,2013,
ES Network - Skyway,610146,Paul Revere Elementary School,337,2013,
ES Network - Skyway,610350,Robert A Black Magnet Elementary School,476,2013,
ES Network - Skyway,610530,South Shore Fine Arts Academy,308,2013,
ES Network - Skyway,610002,Thomas Hoyne Elementary School,271,2013,
ES Network - Skyway,610193,William K New Sullivan Elementary School,521,2013,
HS Network - Far South Side,609753,Chicago High School for Agricultural Sciences,629,2013,
HS Network - Far South Side,609705,Christian Fenger Academy High School,508,2013,
HS Network - Far South Side,609761,George H Corliss High School,558,2013,
HS Network - Far South Side,609760,George Washington Carver Military Academy HS,531,2013,
HS Network - Far South Side,609739,George Washington High School,"1,562",2013,
HS Network - Far South Side,609726,Gwendolyn Brooks College Preparatory Academy HS,745,2013,
HS Network - Far South Side,609710,John M Harlan Community Academy High School,"1,174",2013,
HS Network - Far South Side,609725,Morgan Park High School,"1,449",2013,
HS Network - Far South Side,609762,Percy L Julian High School,"1,167",2013,
HS Network - North-Northwest Side,609720,Albert G Lane Technical High School,"4,270",2013,
HS Network - North-Northwest Side,610524,Alcott High School for the Humanities,269,2013,
HS Network - North-Northwest Side,609729,Carl Schurz High School,"2,395",2013,
HS Network - North-Northwest Side,609679,Charles Allen Prosser Career Academy High School,"1,475",2013,
HS Network - North-Northwest Side,609732,Charles P Steinmetz College Preparatory HS,"1,823",2013,
HS Network - North-Northwest Side,610402,DeVry University Advantage Academy HS,187,2013,
HS Network - North-Northwest Side,609708,Edwin G Foreman High School,"1,572",2013,
HS Network - North-Northwest Side,609737,Friedrich W von Steuben Metropolitan Science HS,"1,654",2013,
HS Network - North-Northwest Side,610390,Hyman G Rickover Naval Academy High School,479,2013,
HS Network - North-Northwest Side,609766,Jacqueline B Vaughn Occupational High School,209,2013,
HS Network - North-Northwest Side,609716,Kelvyn Park High School,"1,037",2013,
HS Network - North-Northwest Side,609719,Lake View High School,"1,545",2013,
HS Network - North-Northwest Side,609738,Lincoln Park High School,"2,233",2013,
HS Network - North-Northwest Side,609774,Louisa May Alcott Elementary School,490,2013,
HS Network - North-Northwest Side,609730,Nicholas Senn High School,"1,045",2013,
HS Network - North-Northwest Side,609749,Northside College Preparatory High School,"1,070",2013,
HS Network - North-Northwest Side,609744,Northside Learning Center High School,289,2013,
HS Network - North-Northwest Side,610529,Ogden International High School,763,2013,
HS Network - North-Northwest Side,609695,Roald Amundsen High School,"1,434",2013,
HS Network - North-Northwest Side,609733,Roger C Sullivan High School,812,2013,
HS Network - North-Northwest Side,609724,Stephen T Mather High School,"1,710",2013,
HS Network - North-Northwest Side,609728,Theodore Roosevelt High School,"1,504",2013,
HS Network - North-Northwest Side,610394,Uplift Community High School,411,2013,
HS Network - North-Northwest Side,609680,Walter Payton College Preparatory High School,859,2013,
HS Network - North-Northwest Side,610101,William B Ogden Elementary School,729,2013,
HS Network - North-Northwest Side,609734,William Howard Taft High School,"3,098",2013,
HS Network - South Side,610323,Bowen High School,538,2013,
HS Network - South Side,610381,Bronzeville Scholastic Academy High School,529,2013,
HS Network - South Side,609754,Chicago Military Academy High School,466,2013,
HS Network - South Side,609674,Chicago Vocational Career Academy High School,965,2013,
HS Network - South Side,610380,Daniel Hale Williams Prep School of Medicine,304,2013,
HS Network - South Side,609751,Dr  Martin Luther King  Jr  College Prep HS,879,2013,
HS Network - South Side,609736,Dyett High School,168,2013,
HS Network - South Side,609712,Emil G Hirsch Metropolitan High School,389,2013,
HS Network - South Side,610297,High School of Leadership at South Shore,411,2013,
HS Network - South Side,609713,Hyde Park Academy High School,"1,249",2013,
HS Network - South Side,609746,Kenwood Academy High School,"1,839",2013,
HS Network - South Side,609692,Neal F Simeon Career Academy High School,"1,529",2013,
HS Network - South Side,609676,Paul Laurence Dunbar Career Academy High School,"1,328",2013,
HS Network - South Side,609769,Ray Graham Training Center High School,116,2013,
HS Network - South Side,610547,South Shore Intl College Prep High School,450,2013,
HS Network - South Side,609678,William Jones College Preparatory High School,883,2013,
HS Network - Southwest Side,610513,Air Force Academy High School,393,2013,
HS Network - Southwest Side,609735,Edward Tilden Career Community Academy HS,400,2013,
HS Network - Southwest Side,609682,Ellen H Richards Career Academy High School,477,2013,
HS Network - Southwest Side,609709,Gage Park High School,835,2013,
HS Network - Southwest Side,609741,Gurdon S Hubbard High School,"1,639",2013,
HS Network - Southwest Side,609768,Hope College Preparatory High School,507,2013,
HS Network - Southwest Side,609718,John F Kennedy High School,"1,505",2013,
HS Network - Southwest Side,609694,John Hancock College Preparatory High School,963,2013,
HS Network - Southwest Side,609756,Marie Sklodowska Curie Metropolitan High School,"3,060",2013,
HS Network - Southwest Side,609707,Paul Robeson High School,591,2013,
HS Network - Southwest Side,610391,Robert Lindblom Math & Science Academy HS,"1,038",2013,
HS Network - Southwest Side,610558,Sarah E. Goode STEM Academy,244,2013,
HS Network - Southwest Side,609745,Southside Occupational Academy High School,202,2013,
HS Network - Southwest Side,610506,TEAM Englewood Community Academy High School,397,2013,
HS Network - Southwest Side,609715,Thomas Kelly High School,"2,691",2013,
HS Network - Southwest Side,609698,William J Bogan High School,"1,409",2013,
HS Network - Southwest Side,609711,William Rainey Harper High School,518,2013,
HS Network - West Side,610334,Al Raby High School,524,2013,
HS Network - West Side,400018,Austin Business and Entrepreneurship Academy HS,236,2013,
HS Network - West Side,610501,Austin Polytechnical Academy High School,192,2013,
HS Network - West Side,609764,Benito Juarez Community Academy High School,"1,790",2013,
HS Network - West Side,609704,David G Farragut Career Academy High School,"1,277",2013,
HS Network - West Side,610245,Frederick A Douglass Academy High School,316,2013,
HS Network - West Side,609693,George Westinghouse High School,"1,116",2013,
HS Network - West Side,610383,Greater Lawndale High School For Social Justice,356,2013,
HS Network - West Side,610384,Infinity Math Science and Technology High School,410,2013,
HS Network - West Side,609723,John Marshall Metropolitan High School,677,2013,
HS Network - West Side,609722,Manley Career Academy High School,476,2013,
HS Network - West Side,610502,Marine Military Math and Science Academy,376,2013,
HS Network - West Side,610535,Mason High School,60,2013,
HS Network - West Side,610244,Michele Clark Academic Prep Magnet High School,574,2013,
HS Network - West Side,610385,Multicultural Academy of Scholarship,290,2013,
HS Network - West Side,609691,North-Grand High School,904,2013,
HS Network - West Side,610304,Phoenix Military Academy High School,429,2013,
HS Network - West Side,609702,Richard T Crane Technical Preparatory HS,387,2013,
HS Network - West Side,609759,Roberto Clemente Community Academy High School,891,2013,
HS Network - West Side,610357,Spry Community Links High School,193,2013,
HS Network - West Side,610518,VOISE Academy High School,367,2013,
HS Network - West Side,609740,Wells Community Academy High School,611,2013,
HS Network - West Side,609755,Whitney M Young Magnet High School,"2,203",2013,
HS Network - West Side,610392,World Language Academy High School,371,2013,
Network - AUSL,609883,Charles S Deneen Elementary School,549,2013,
Network - AUSL,610248,Chicago Academy Elementary School,601,2013,
Network - AUSL,610340,Chicago Academy High School,517,2013,
Network - AUSL,610499,Collins Academy High School,433,2013,
Network - AUSL,610543,Eric Solorio Academy High School,843,2013,
Network - AUSL,609900,George W Curtis Elementary School,474,2013,
Network - AUSL,610274,James Weldon Johnson Elementary School,402,2013,
Network - AUSL,610263,John Foster Dulles Elementary School,528,2013,
Network - AUSL,609971,John Harvard Elementary School of Excellence,441,2013,
Network - AUSL,610000,Julia Ward Howe Elementary School of Excellence,610,2013,
Network - AUSL,609888,Mary Mapes Dodge Elementary Renaissance Academy,433,2013,
Network - AUSL,610365,Mary McLeod Bethune Elementary School,377,2013,
Network - AUSL,610257,Morton School of Excellence,355,2013,
Network - AUSL,609806,Myra Bradwell Communications Arts & Sciences ES,788,2013,
Network - AUSL,610231,National Teachers Elementary Academy,533,2013,
Network - AUSL,610389,Orr Academy High School,676,2013,
Network - AUSL,610396,Tarkington School of Excellence ES,"1,073",2013,
Network - AUSL,609727,Wendell Phillips Academy High School,647,2013,
Network - AUSL,610172,William T Sherman Elementary School,440,2013,
Network - Alternative,610556,Banner Academy South,268,2013,
Network - Alternative,610555,Banner Academy West,164,2013,
Network - Alternative,610549,Banner North Elementary School,5,2013,
Network - Alternative,610550,Banner North High School,24,2013,
Network - Alternative,609748,Consuella B York Alternative High School,339,2013,
Network - Alternative,610552,Milburn Alternative School,48,2013,
Network - Alternative,609783,Nancy B Jefferson Alternative High School,240,2013,
Network - Alternative,610557,Pathways in Education,202,2013,
Network - Alternative,610386,Peace & Education Coalition High School,114,2013,
Network - Alternative,609750,Simpson Academy High School for Young Women,95,2013,
Network - Alternative,610554,Vivian E. Summers Alternative School,26,2013,
Network - Charter/Contract,400013,ASPIRA Charter - Early College,511,2013,
Network - Charter/Contract,400017,ASPIRA Charter - Haugan Campus,578,2013,
Network - Charter/Contract,400015,ASPIRA Charter - Mirta Ramirez Computer Science,373,2013,
Network - Charter/Contract,400009,Academy for Global Citizenship Elementary School,296,2013,
Network - Charter/Contract,400146,Academy of Communication & Tech Charter School,81,2013,
Network - Charter/Contract,400011,Alain Locke Charter Elementary Academy,588,2013,
Network - Charter/Contract,400012,Amandla Charter High School,311,2013,
Network - Charter/Contract,400010,"Architecture, Construction, and Engineering(ACE)T",482,2013,
Network - Charter/Contract,400060,Asian Human Services - Passages Charter School,421,2013,
Network - Charter/Contract,400072,Betty Shabazz Intl Charter,300,2013,
Network - Charter/Contract,400074,Betty Shabazz Intl Charter - Barbara A Sizemore,307,2013,
Network - Charter/Contract,400073,Betty Shabazz Intl Charter - DuSable Leadership,333,2013,
Network - Charter/Contract,400019,Bronzeville Lighthouse Charter Elementary School,471,2013,
Network - Charter/Contract,400020,Catalyst Charter ES - Howland,498,2013,
Network - Charter/Contract,400021,Catalyst Elementary School - Circle Rock,529,2013,
Network - Charter/Contract,400115,Catalyst-Maria Charter School,557,2013,
Network - Charter/Contract,400147,Chicago Excel Academy,86,2013,
Network - Charter/Contract,400022,Chicago High School for the Arts,583,2013,
Network - Charter/Contract,400023,Chicago Intl Charter - Avalon / South Shore,422,2013,
Network - Charter/Contract,400024,Chicago Intl Charter - Basil,717,2013,
Network - Charter/Contract,400025,Chicago Intl Charter - Bucktown,672,2013,
Network - Charter/Contract,400113,Chicago Intl Charter - Chicago Quest North,298,2013,
Network - Charter/Contract,400027,Chicago Intl Charter - Irving Park,527,2013,
Network - Charter/Contract,400108,Chicago Intl Charter - Larry Hawkins,371,2013,
Network - Charter/Contract,400092,Chicago Intl Charter - Lloyd Bond,354,2013,
Network - Charter/Contract,400033,Chicago Intl Charter - Longwood,"1,412",2013,
Network - Charter/Contract,400026,Chicago Intl Charter - Loomis Primary,587,2013,
Network - Charter/Contract,400034,Chicago Intl Charter - Northtown,865,2013,
Network - Charter/Contract,400028,Chicago Intl Charter - Prairie,406,2013,
Network - Charter/Contract,400032,Chicago Intl Charter - Ralph Ellison,552,2013,
Network - Charter/Contract,400029,Chicago Intl Charter - Washington Park,448,2013,
Network - Charter/Contract,400030,Chicago Intl Charter - West Belden,500,2013,
Network - Charter/Contract,400031,Chicago Intl Charter - Wrightwood,725,2013,
Network - Charter/Contract,400035,Chicago Math and Science Academy High School,598,2013,
Network - Charter/Contract,400093,Chicago Talent Development HS,286,2013,
Network - Charter/Contract,400091,Chicago Technology Academy High School,381,2013,
Network - Charter/Contract,400036,Chicago Virtual Charter High School,602,2013,
Network - Charter/Contract,400038,Community Services West Academy,160,2013,
Network - Charter/Contract,400094,EPIC Academy High School,487,2013,
Network - Charter/Contract,400039,Erie Elementary Charter School,414,2013,
Network - Charter/Contract,400040,Frazier Preparatory Academy Elementary School,441,2013,
Network - Charter/Contract,400041,Galapagos Elementary Charter School,365,2013,
Network - Charter/Contract,400042,Henry Ford Academy Power House Charter HS,360,2013,
Network - Charter/Contract,400043,Hope Institute Learning Academy,379,2013,
Network - Charter/Contract,400104,Instituto Health Sciences Career Academy HS,532,2013,
Network - Charter/Contract,400148,Instituto Justice and Leadership Acad Charter HS,168,2013,
Network - Charter/Contract,400044,KIPP Ascend Academy Charter Elementary School,665,2013,
Network - Charter/Contract,400045,Kwame Nkrumah Academy Elementary School,244,2013,
Network - Charter/Contract,400107,LEARN  Charter School-South Chicago Campus,344,2013,
Network - Charter/Contract,400047,LEARN Charter ES - Charles and Dorothy Campbell,441,2013,
Network - Charter/Contract,400048,LEARN Charter ES - Excel,342,2013,
Network - Charter/Contract,400046,LEARN Charter ES - Romano Butler Campus,624,2013,
Network - Charter/Contract,400111,LEARN Charter School - Hunter Perkins,315,2013,
Network - Charter/Contract,400049,Legacy Charter Elementary School,503,2013,
Network - Charter/Contract,400119,Legal Prep Charter Academy,196,2013,
Network - Charter/Contract,400050,Namaste Charter Elementary School,465,2013,
Network - Charter/Contract,400097,Noble Street Charter - Chicago Bulls College,"1,029",2013,
Network - Charter/Contract,400052,Noble Street Charter - Gary Comer College Prep,812,2013,
Network - Charter/Contract,400053,Noble Street Charter - Golder College Prep,601,2013,
Network - Charter/Contract,400098,Noble Street Charter - Muchin College Prep,862,2013,
Network - Charter/Contract,400051,Noble Street Charter - Noble Street College Prep,615,2013,
Network - Charter/Contract,400054,Noble Street Charter - Pritzker College Prep,805,2013,
Network - Charter/Contract,400055,Noble Street Charter - Rauner College Prep,629,2013,
Network - Charter/Contract,400056,Noble Street Charter - Rowe-Clark Math & Sci Acad,626,2013,
Network - Charter/Contract,400057,Noble Street Charter - UIC College Prep,794,2013,
Network - Charter/Contract,400118,Noble Street Charter School - Purple,228,2013,
Network - Charter/Contract,400117,Noble Street Charter School - Silver,257,2013,
Network - Charter/Contract,400106,Noble Street Charter School – Johnson HS,609,2013,
Network - Charter/Contract,400058,North Lawndale College Prep Charter - Christiana,454,2013,
