Network,School ID,School,Total,Year,Area
ES Network - Austin-North Lawndale,610131,Ambrose Plamondon Elementary School,178,2013,
ES Network - Austin-North Lawndale,610005,Charles Evans Hughes Elementary School,286,2013,
ES Network - Austin-North Lawndale,609873,Crown Community Academy of Fine Arts Center ES,279,2013,
ES Network - Austin-North Lawndale,610254,Dvorak Technology Academy,534,2013,
ES Network - Austin-North Lawndale,609904,Edward K Ellington Elementary School,337,2013,
ES Network - Austin-North Lawndale,610235,Ella Flagg Young Elementary School,"1,121",2013,
ES Network - Austin-North Lawndale,610020,Francis Scott Key Elementary School,306,2013,
ES Network - Austin-North Lawndale,610503,Frazier Prospective IB Magnet ES,224,2013,
ES Network - Austin-North Lawndale,610305,George Leland Elementary School,170,2013,
ES Network - Austin-North Lawndale,609795,George Rogers Clark Elementary School,278,2013,
ES Network - Austin-North Lawndale,610158,Harriet E Sayre Elementary Language Academy,592,2013,
ES Network - Austin-North Lawndale,610092,Henry H Nash Elementary School,392,2013,
ES Network - Austin-North Lawndale,610058,Horatio May Elementary Community Academy,463,2013,
ES Network - Austin-North Lawndale,609975,John Hay Elementary Community Academy,582,2013,
ES Network - Austin-North Lawndale,610043,Joseph Lovett Elementary School,488,2013,
ES Network - Austin-North Lawndale,610034,Lawndale Elementary Community Academy,478,2013,
ES Network - Austin-North Lawndale,610036,Leslie Lewis Elementary School,569,2013,
ES Network - Austin-North Lawndale,610156,Louis Armstrong Math & Science Elementary School,98,2013,
ES Network - Austin-North Lawndale,610240,Matthew A Henson Elementary School,252,2013,
ES Network - Austin-North Lawndale,609830,Milton Brunson Math & Science Specialty ES,622,2013,
ES Network - Austin-North Lawndale,610134,Nathaniel Pope Elementary School,184,2013,
ES Network - Austin-North Lawndale,610367,Oscar DePriest Elementary School,549,2013,
ES Network - Austin-North Lawndale,609906,Robert Emmet Elementary School,458,2013,
ES Network - Austin-North Lawndale,610282,Ronald E McNair Elementary School,395,2013,
ES Network - Austin-North Lawndale,610056,Roswell B Mason Elementary School,485,2013,
ES Network - Austin-North Lawndale,610183,Spencer Technology Academy,838,2013,
ES Network - Austin-North Lawndale,609991,Theodore Herzl Elementary School,502,2013,
ES Network - Austin-North Lawndale,609851,Thomas Chalmers Specialty Elementary School,364,2013,
ES Network - Austin-North Lawndale,610123,William Penn Elementary School,370,2013,
ES Network - Burnham Park,609837,Andrew Carnegie Elementary School,692,2013,
ES Network - Burnham Park,610277,Anthony Overton Elementary School,431,2013,
ES Network - Burnham Park,609951,Ariel Elementary Community Academy,559,2013,
ES Network - Burnham Park,610169,Austin O Sexton Elementary School,359,2013,
ES Network - Burnham Park,610150,Betsy Ross Elementary School,344,2013,
ES Network - Burnham Park,610175,Beulah Shoesmith Elementary School,345,2013,
ES Network - Burnham Park,609969,Bret Harte Elementary School,328,2013,
ES Network - Burnham Park,610345,Carter G Woodson South Elementary School,370,2013,
ES Network - Burnham Park,610030,Charles Kozminski Elementary Community Academy,370,2013,
ES Network - Burnham Park,609781,Crispus Attucks Elementary School,275,2013,
ES Network - Burnham Park,610266,Dumas Technology Academy,331,2013,
ES Network - Burnham Park,609819,Edmond Burke Elementary School,272,2013,
ES Network - Burnham Park,610246,Edward Beasley Elementary Magnet Academic Center,"1,455",2013,
ES Network - Burnham Park,610065,Emmett Louis Till Math and Science Academy,492,2013,
ES Network - Burnham Park,610110,Ida B Wells Preparatory Elementary Academy,198,2013,
ES Network - Burnham Park,610276,Irvin C Mollison Elementary School,237,2013,
ES Network - Burnham Park,610256,Jackie Robinson Elementary School,139,2013,
ES Network - Burnham Park,609891,James R Doolittle Jr Elementary School,295,2013,
ES Network - Burnham Park,610213,James Wadsworth Elementary School,251,2013,
ES Network - Burnham Park,609894,John B Drake Elementary School,242,2013,
ES Network - Burnham Park,609919,John Fiske Elementary School,220,2013,
ES Network - Burnham Park,610126,John J Pershing Elementary Humanities Magnet,249,2013,
ES Network - Burnham Park,610237,Ludwig Van Beethoven Elementary School,389,2013,
ES Network - Burnham Park,609928,Melville W Fuller Elementary School,270,2013,
ES Network - Burnham Park,610018,Miriam G Canter Middle School,228,2013,
ES Network - Burnham Park,610395,Pershing West Middle School,240,2013,
ES Network - Burnham Park,610090,Phillip Murray Elementary Language Academy,523,2013,
ES Network - Burnham Park,609990,South Loop Elementary School,815,2013,
ES Network - Burnham Park,610143,William C Reavis Math & Science Specialty ES,279,2013,
ES Network - Burnham Park,610142,William H Ray Elementary School,676,2013,
ES Network - Burnham Park,610061,William J & Charles H Mayo Elementary School,408,2013,
ES Network - Burnham Park,609844,William W Carter Elementary School,346,2013,
ES Network - Burnham Park,610232,Williams Multiplex Elementary School,256,2013,
ES Network - Burnham Park,610336,Williams Preparatory Academy Middle School,127,2013,
ES Network - Burnham Park,609977,Woodlawn Community Elementary School,244,2013,
ES Network - Englewood-Gresham,610339,Amos Alonzo Stagg Elementary School,535,2013,
ES Network - Englewood-Gresham,609869,Anna R. Langford Community Academy,325,2013,
ES Network - Englewood-Gresham,610161,Arna Wendell Bontemps Elementary School,314,2013,
ES Network - Englewood-Gresham,609941,Asa Philip Randolph Elementary School,538,2013,
ES Network - Englewood-Gresham,610265,Benjamin Banneker Elementary School,337,2013,
ES Network - Englewood-Gresham,610290,Benjamin E Mays Elementary Academy,307,2013,
ES Network - Englewood-Gresham,610238,Carrie Jacobs Bond Elementary School,478,2013,
ES Network - Englewood-Gresham,609986,Charles R Henderson Elementary School,356,2013,
ES Network - Englewood-Gresham,609897,Charles W Earle Elementary School,358,2013,
ES Network - Englewood-Gresham,609790,Clara Barton Elementary School,643,2013,
ES Network - Englewood-Gresham,610223,Daniel S Wentworth Elementary School,333,2013,
ES Network - Englewood-Gresham,609913,Elaine O Goodlow Elementary Magnet School,378,2013,
ES Network - Englewood-Gresham,609927,Foster Park Elementary School,401,2013,
ES Network - Englewood-Gresham,610112,Francis W Parker Elementary Community Academy,836,2013,
ES Network - Englewood-Gresham,610072,Garrett A Morgan Elementary School,236,2013,
ES Network - Englewood-Gresham,610285,Granville T Woods Math & Science Academy ES,371,2013,
ES Network - Englewood-Gresham,610173,Jesse Sherwood Elementary School,312,2013,
ES Network - Englewood-Gresham,609775,John P Altgeld Elementary School,443,2013,
ES Network - Englewood-Gresham,609864,John W Cook Elementary School,459,2013,
ES Network - Englewood-Gresham,610019,Joshua D Kershaw Elementary School,260,2013,
ES Network - Englewood-Gresham,610108,Luke O'Toole Elementary School,434,2013,
ES Network - Englewood-Gresham,610369,Mahalia Jackson Elementary School,302,2013,
ES Network - Englewood-Gresham,609793,Nicholson Technology Academy,469,2013,
ES Network - Englewood-Gresham,609997,Oliver Wendell Holmes Elementary School,288,2013,
ES Network - Englewood-Gresham,610003,Paul Cuffe Math-Science Technology Academy ES,458,2013,
ES Network - Englewood-Gresham,609791,Perkins Bass Elementary School,336,2013,
ES Network - Englewood-Gresham,610102,Richard J Oglesby Elementary School,442,2013,
ES Network - Englewood-Gresham,609805,Scott Joplin Elementary School,493,2013,
ES Network - Englewood-Gresham,610521,Sir Miles Davis Magnet Elementary Academy,291,2013,
ES Network - Englewood-Gresham,609955,Walter Q Gresham Elementary School,341,2013,
ES Network - Englewood-Gresham,610299,William A Hinton Elementary School,281,2013,
ES Network - Englewood-Gresham,610153,William H Ryder Math & Science Specialty ES,305,2013,
ES Network - Fullerton,610038,Abraham Lincoln Elementary School,781,2013,
ES Network - Fullerton,609780,Ames Middle School,480,2013,
ES Network - Fullerton,609922,Belmont-Cragin Elementary School,613,2013,
ES Network - Fullerton,610039,Carl von Linne Elementary School,696,2013,
ES Network - Fullerton,609875,Charles R Darwin Elementary School,584,2013,
ES Network - Fullerton,610533,Dr Jorge Prieto Math and Science,"1,022",2013,
ES Network - Fullerton,610012,Edward Jenner Elementary Academy of the Arts,317,2013,
ES Network - Fullerton,610541,Federico Garcia Lorca Elementary School,901,2013,
ES Network - Fullerton,610144,Frank W Reilly Elementary School,"1,177",2013,
ES Network - Fullerton,609926,Franklin Elementary Fine Arts Center,365,2013,
ES Network - Fullerton,610165,Franz Peter Schubert Elementary School,919,2013,
ES Network - Fullerton,609930,Frederick Funston Elementary School,623,2013,
ES Network - Fullerton,610048,George Manierre Elementary School,351,2013,
ES Network - Fullerton,610068,Hanson Park Elementary School,"1,569",2013,
ES Network - Fullerton,610040,Henry D Lloyd Elementary School,"1,289",2013,
ES Network - Fullerton,610074,James Monroe Elementary School,"1,115",2013,
ES Network - Fullerton,609942,Johann W von Goethe Elementary School,799,2013,
ES Network - Fullerton,609789,John Barry Elementary School,804,2013,
ES Network - Fullerton,610041,Josephine C Locke Elementary School,"1,323",2013,
ES Network - Fullerton,610033,LaSalle Elementary Language Academy,577,2013,
ES Network - Fullerton,609910,Laughlin Falconer Elementary School,"1,441",2013,
ES Network - Fullerton,610325,Logandale Middle School,950,2013,
ES Network - Fullerton,609809,Lorenz Brentano Math & Science Academy ES,426,2013,
ES Network - Fullerton,609818,Luther Burbank Elementary School,999,2013,
ES Network - Fullerton,610539,Marvin Camras Elementary School,985,2013,
ES Network - Fullerton,610046,Mary Lyon Elementary School,"1,403",2013,
ES Network - Fullerton,610051,Northwest Middle School,692,2013,
ES Network - Fullerton,610059,Oscar F Mayer Elementary School,599,2013,
ES Network - Fullerton,610138,Pulaski International School of Chicago,900,2013,
ES Network - Fullerton,610234,Richard Yates Elementary School,732,2013,
ES Network - Fullerton,610250,Rueben Salazar Elementary Bilingual Center,438,2013,
ES Network - Fullerton,609853,Salmon P Chase Elementary School,511,2013,
ES Network - Fullerton,609968,Sharon Christa McAuliffe Elementary School,733,2013,
ES Network - Fullerton,610534,Skinner North,301,2013,
ES Network - Fullerton,609896,Thomas Drummond Elementary School,353,2013,
ES Network - Fullerton,610095,Walter L Newberry Math & Science Academy ES,565,2013,
ES Network - Fullerton,610136,William H Prescott Elementary School,270,2013,
ES Network - Fullerton,610097,William P Nixon Elementary School,"1,099",2013,
ES Network - Fullerton,610088,Wolfgang A Mozart Elementary School,791,2013,
ES Network - Fulton,610229,A.N. Pritzker School,676,2013,
ES Network - Fulton,610342,Albert R Sabin Elementary Magnet School,602,2013,
ES Network - Fulton,610210,Alexander von Humboldt Elementary School,362,2013,
ES Network - Fulton,610320,Ana Roque de Duprey Elementary School,92,2013,
ES Network - Fulton,610060,Andrew Jackson Elementary Language Academy,561,2013,
ES Network - Fulton,610076,Bernhard Moos Elementary School,429,2013,
ES Network - Fulton,609863,Christopher Columbus Elementary School,298,2013,
ES Network - Fulton,610119,Elizabeth Peabody Elementary School,266,2013,
ES Network - Fulton,610073,Ellen Mitchell Elementary School,345,2013,
ES Network - Fulton,609854,Frederic Chopin Elementary School,267,2013,
ES Network - Fulton,610009,Galileo Math & Science Scholastic Academy ES,603,2013,
ES Network - Fulton,610107,James Otis Elementary School,471,2013,
ES Network - Fulton,610031,Jean D Lafayette Elementary School,470,2013,
ES Network - Fulton,610180,John M Smyth Elementary School,473,2013,
ES Network - Fulton,609828,Jonathan Burr Elementary School,350,2013,
ES Network - Fulton,610313,Jose De Diego Elementary Community Academy,807,2013,
ES Network - Fulton,610520,LaSalle II Magnet Elementary School,630,2013,
ES Network - Fulton,610197,Mancel Talcott Elementary School,558,2013,
ES Network - Fulton,610177,Mark Skinner Elementary School,846,2013,
ES Network - Fulton,610075,Moses Montefiore Special Elementary School,27,2013,
ES Network - Fulton,610085,Near North Elementary School,90,2013,
ES Network - Fulton,610252,Robert Nathaniel Dett Elementary School,202,2013,
ES Network - Fulton,610029,Rodolfo Lozano Bilingual & International Ctr ES,311,2013,
ES Network - Fulton,610548,STEM Magnet Academy,292,2013,
ES Network - Fulton,610405,Suder Montessori Magnet ES,388,2013,
ES Network - Fulton,609989,Victor Herbert Elementary School,355,2013,
ES Network - Fulton,610121,Washington Irving Elementary School,451,2013,
ES Network - Fulton,609812,William H Brown Elementary School,214,2013,
ES Network - Fulton,610023,William H King Elementary School,284,2013,
ES Network - Fulton,610308,Wilma Rudolph Elementary Learning Center,96,2013,
ES Network - Garfield-Humboldt,610098,Alfred Nobel Elementary School,848,2013,
ES Network - Garfield-Humboldt,610106,Brian Piccolo Elementary Specialty School,513,2013,
ES Network - Garfield-Humboldt,610194,Charles Sumner  Math & Science Community Acad ES,375,2013,
ES Network - Garfield-Humboldt,609835,Daniel R Cameron Elementary School,835,2013,
ES Network - Garfield-Humboldt,610221,Daniel Webster Elementary School,338,2013,
ES Network - Garfield-Humboldt,609881,Edward C Delano Elementary School,395,2013,
ES Network - Garfield-Humboldt,400095,Garfield Park Preparatory Academy ES,154,2013,
ES Network - Garfield-Humboldt,610293,Genevieve Melody Elementary School,293,2013,
ES Network - Garfield-Humboldt,610202,George W Tilton Elementary School,303,2013,
ES Network - Garfield-Humboldt,610241,Guglielmo Marconi Elementary Community Academy,233,2013,
ES Network - Garfield-Humboldt,610192,Harriet Beecher Stowe Elementary School,806,2013,
ES Network - Garfield-Humboldt,609985,Helen M Hefferan Elementary School,251,2013,
ES Network - Garfield-Humboldt,609797,Jacob Beidler Elementary School,434,2013,
ES Network - Garfield-Humboldt,610044,James Russell Lowell Elementary School,568,2013,
ES Network - Garfield-Humboldt,610271,Jensen Elementary Scholastic Academy,349,2013,
ES Network - Garfield-Humboldt,610243,John Calhoun North Elementary School,314,2013,
ES Network - Garfield-Humboldt,609954,John Milton Gregory Elementary School,330,2013,
ES Network - Garfield-Humboldt,609925,Joseph Kellman Corporate Community ES,274,2013,
ES Network - Garfield-Humboldt,610133,Laura S Ward Elementary School,398,2013,
ES Network - Garfield-Humboldt,609907,Leif Ericson Elementary Scholastic Academy,510,2013,
ES Network - Garfield-Humboldt,610154,Martin A Ryerson Elementary School,399,2013,
ES Network - Garfield-Humboldt,610055,Michael Faraday Elementary School,184,2013,
ES Network - Garfield-Humboldt,610348,Nathan R Goldblatt Elementary School,236,2013,
ES Network - Garfield-Humboldt,610021,Pablo Casals Elementary School,463,2013,
ES Network - Garfield-Humboldt,610100,West Park Elementary Academy,680,2013,
ES Network - Garfield-Humboldt,610251,Willa Cather Elementary School,237,2013,
ES Network - Lake Calumet,609821,Burnham Elementary Inclusive Academy,268,2013,
ES Network - Lake Calumet,610198,Douglas Taylor Elementary School,604,2013,
ES Network - Lake Calumet,610132,Edgar Allan Poe Elementary Classical School,193,2013,
ES Network - Lake Calumet,610315,Edward White Elementary Career Academy,137,2013,
ES Network - Lake Calumet,610139,George M Pullman Elementary School,257,2013,
ES Network - Lake Calumet,609845,George Washington Carver Primary School,527,2013,
ES Network - Lake Calumet,610219,George Washington Elementary School,829,2013,
ES Network - Lake Calumet,609856,Henry Clay Elementary School,617,2013,
ES Network - Lake Calumet,609848,Ira F Aldridge Elementary School,250,2013,
ES Network - Lake Calumet,609772,Jane Addams Elementary School,901,2013,
ES Network - Lake Calumet,609932,Jesse Owens Elementary Community Academy,328,2013,
ES Network - Lake Calumet,610054,John L Marsh Elementary School,850,2013,
ES Network - Lake Calumet,610225,John Whistler Elementary School,324,2013,
ES Network - Lake Calumet,610199,Johnnie Colemon Elementary Academy,272,2013,
ES Network - Lake Calumet,609935,Matthew Gallistel Elementary Language Academy,"1,393",2013,
ES Network - Lake Calumet,609811,Orville T Bright Elementary School,307,2013,
ES Network - Lake Calumet,609902,Ralph H Metcalfe Elementary Community Academy,452,2013,
ES Network - Lake Calumet,610045,Robert H Lawrence Elementary School,398,2013,
ES Network - Lake Calumet,610091,Ronald Brown Elementary Community Academy,289,2013,
ES Network - Lake Calumet,609943,Samuel Gompers Fine Arts Options ES,246,2013,
ES Network - Lake Calumet,610160,Songhai Elementary Learning Institute,317,2013,
ES Network - Lake Calumet,610178,Theophilus Schmid Elementary School,187,2013,
ES Network - Lake Calumet,610295,Thomas J Higgins Elementary Community Academy,383,2013,
ES Network - Lake Calumet,609944,Virgil Grissom Elementary School,326,2013,
ES Network - Lake Calumet,609978,Wendell Smith Elementary School,339,2013,
ES Network - Lake Calumet,610224,West Pullman Elementary School,301,2013,
ES Network - Lake Calumet,610364,William E B Dubois Elementary School,174,2013,
ES Network - Midway,610185,Adlai E Stevenson Elementary School,"1,275",2013,
ES Network - Midway,610287,Ashburn Community Elementary School,461,2013,
ES Network - Midway,610087,Blair Early Childhood Center,147,2013,
ES Network - Midway,609839,Carroll-Rosenwald Specialty Elementary School,557,2013,
ES Network - Midway,609879,Charles Gates Dawes Elementary School,"1,051",2013,
ES Network - Midway,610347,Claremont Academy Elementary School,507,2013,
ES Network - Midway,610077,Donald Morrill Math & Science Elementary School,836,2013,
ES Network - Midway,610352,Durkin Park Elementary School,585,2013,
ES Network - Midway,610006,Edward N Hurley Elementary School,849,2013,
ES Network - Midway,610203,Enrico Tonti Elementary School,979,2013,
ES Network - Midway,610057,Fairfield Elementary Academy,592,2013,
ES Network - Midway,610120,Ferdinand Peck Elementary School,"1,564",2013,
ES Network - Midway,610096,Florence Nightingale Elementary School,"1,399",2013,
ES Network - Midway,610067,Francis M McKay Elementary School,845,2013,
ES Network - Midway,610532,Irene C. Hernandez Middle School for the Advancem,990,2013,
ES Network - Midway,609893,John C Dore Elementary School,640,2013,
ES Network - Midway,609898,John F Eberhart Elementary School,"1,694",2013,
ES Network - Midway,610026,John H Kinzie Elementary School,703,2013,
ES Network - Midway,609807,Lionel Hampton Fine & Performing Arts ES,645,2013,
ES Network - Midway,610117,Louis Pasteur Elementary School,"1,237",2013,
ES Network - Midway,610544,Mariano Azuela Elementary School,935,2013,
ES Network - Midway,610206,Mark Twain Elementary School,"1,198",2013,
ES Network - Midway,610053,Marquette Elementary School,"1,332",2013,
ES Network - Midway,609832,Michael M Byrne Elementary School,664,2013,
ES Network - Midway,609960,Nathan Hale Elementary School,881,2013,
ES Network - Midway,609981,Phobe Apperson Hearst Elementary School,363,2013,
ES Network - Midway,609842,Rachel Carson Elementary School,"1,247",2013,
ES Network - Midway,609903,Richard Edwards Elementary School,"1,506",2013,
ES Network - Midway,610291,Richard Henry Lee Elementary School,876,2013,
ES Network - Midway,609956,Robert L Grimes Elementary School,476,2013,
ES Network - Midway,610157,Sidney Sawyer Elementary School,"1,887",2013,
ES Network - Midway,610226,Socorro Sandoval Elementary School,"1,208",2013,
ES Network - Midway,610249,Talman Elementary School,382,2013,
ES Network - Midway,609855,Walter S Christopher Elementary School,290,2013,
ES Network - Midway,610109,William Bishop Owen Scholastic Academy ES,240,2013,
ES Network - O'Hare,610212,Albany Park Multicultural Academy,269,2013,
ES Network - O'Hare,610209,Alessandro Volta Elementary School,"1,006",2013,
ES Network - O'Hare,609836,Arthur E Canty Elementary School,799,2013,
ES Network - O'Hare,609899,Christian Ebinger Elementary School,704,2013,
ES Network - O'Hare,610083,Daniel C Beard Elementary School,160,2013,
ES Network - O'Hare,610515,Disney II Magnet School,415,2013,
ES Network - O'Hare,609901,Edgebrook Elementary School,494,2013,
ES Network - O'Hare,610523,Edison Park Elementary School,453,2013,
ES Network - O'Hare,610137,Ernst Prussing Elementary School,664,2013,
ES Network - O'Hare,609874,Everett McKinley Dirksen Elementary School,785,2013,
ES Network - O'Hare,610163,Frederick Stock Elementary School,268,2013,
ES Network - O'Hare,609857,Grover Cleveland Elementary School,716,2013,
ES Network - O'Hare,610182,Hannah G Solomon Elementary School,364,2013,
ES Network - O'Hare,609972,Helge A Haugan Elementary School,"1,268",2013,
ES Network - O'Hare,609798,Hiram H Belding Elementary School,665,2013,
ES Network - O'Hare,609912,James B Farnsworth Elementary School,597,2013,
ES Network - O'Hare,609796,Jean Baptiste Beaubien Elementary School,"1,165",2013,
ES Network - O'Hare,610089,John B Murphy Elementary School,602,2013,
ES Network - O'Hare,610111,John Palmer Elementary School,971,2013,
ES Network - O'Hare,609937,John W Garvy Elementary School,772,2013,
ES Network - O'Hare,610159,Jonathan Y Scammon Elementary School,893,2013,
ES Network - O'Hare,610127,Mary Gage Peterson Elementary School,855,2013,
ES Network - O'Hare,609792,Newton Bateman Elementary School,"1,039",2013,
ES Network - O'Hare,609810,Norman A Bridge Elementary School,"1,030",2013,
ES Network - O'Hare,610354,North River Elementary School,373,2013,
ES Network - O'Hare,610099,Norwood Park Elementary School,338,2013,
ES Network - O'Hare,610201,Ole A Thorp Elementary Scholastic Academy,832,2013,
ES Network - O'Hare,610105,Oriole Park Elementary School,652,2013,
ES Network - O'Hare,609988,Patrick Henry Elementary School,653,2013,
ES Network - O'Hare,610145,Peter A Reinberg Elementary School,854,2013,
ES Network - O'Hare,610135,Portage Park Elementary School,"1,116",2013,
ES Network - O'Hare,609995,Rufus M Hitch Elementary School,554,2013,
ES Network - O'Hare,610155,Sauganash Elementary School,560,2013,
ES Network - O'Hare,609794,Thomas A Edison Regional Gifted Center ES,269,2013,
ES Network - O'Hare,610321,Thurgood Marshall Middle School,431,2013,
ES Network - O'Hare,610179,Washington D Smyser Elementary School,"1,013",2013,
ES Network - O'Hare,610230,Wildwood Elementary School,420,2013,
ES Network - O'Hare,609884,William E Dever Elementary School,844,2013,
ES Network - O'Hare,609994,William G Hibbard Elementary School,"1,214",2013,
ES Network - O'Hare,610104,William J Onahan Elementary School,660,2013,
ES Network - O'Hare,609949,William P Gray Elementary School,"1,285",2013,
ES Network - Pershing,609993,Agustin Lara Elementary Academy,548,2013,
ES Network - Pershing,609947,Alexander Graham Elementary School,498,2013,
ES Network - Pershing,610037,Arthur A Libby Elementary School,544,2013,
ES Network - Pershing,610317,Brighton Park Elementary School,646,2013,
ES Network - Pershing,610353,Calmeca Academy of Fine Arts and Dual Language,839,2013,
ES Network - Pershing,610148,Cesar E Chavez Multicultural Academic Center ES,937,2013,
ES Network - Pershing,609996,Charles N Holden Elementary School,592,2013,
ES Network - Pershing,610170,Columbia Explorers Elementary Academy,"1,052",2013,
ES Network - Pershing,609885,Dewey Elementary Academy of Fine Arts,334,2013,
ES Network - Pershing,609909,Edward Everett Elementary School,312,2013,
ES Network - Pershing,610319,Evergreen Academy Middle School,400,2013,
ES Network - Pershing,610114,Francis Parkman Elementary School,231,2013,
ES Network - Pershing,609958,Frank W Gunsaulus Elementary Scholastic Academy,843,2013,
ES Network - Pershing,610062,George B McClellan Elementary School,268,2013,
ES Network - Pershing,609983,James Hedges Elementary School,868,2013,
ES Network - Pershing,610174,James Shields Elementary School,"1,143",2013,
ES Network - Pershing,610559,James Shields Middle School,770,2013,
ES Network - Pershing,610217,James Ward Elementary School,507,2013,
ES Network - Pershing,609829,John C Burroughs Elementary School,503,2013,
ES Network - Pershing,609959,John Charles Haines Elementary School,691,2013,
ES Network - Pershing,609964,John H Hamline Elementary School,637,2013,
ES Network - Pershing,610081,Mark Sheridan Elementary Math & Science Academy,537,2013,
ES Network - Pershing,609876,Nathan S Davis Elementary School,980,2013,
ES Network - Pershing,609952,Nathanael Greene Elementary School,622,2013,
ES Network - Pershing,609777,Phillip D Armour Elementary School,359,2013,
ES Network - Pershing,610239,Richard J Daley Elementary Academy,754,2013,
ES Network - Pershing,609929,Robert Fulton Elementary School,471,2013,
ES Network - Pershing,609979,Robert Healy Elementary School,"1,372",2013,
ES Network - Pershing,609987,Thomas A Hendricks Elementary Community Academy,287,2013,
ES Network - Pershing,610504,Velma F Thomas Early Childhood Center,205,2013,
ES Network - Pershing,610167,William H Seward Communication Arts Academy ES,854,2013,
ES Network - Pilsen-Little Village,609966,Charles G Hammond Elementary School,469,2013,
ES Network - Pilsen-Little Village,610063,Cyrus H McCormick Elementary School,869,2013,
ES Network - Pilsen-Little Village,609870,Daniel J Corkery Elementary School,614,2013,
